{
  "schemaVersion": "2",
  "recordType": "observed-result-v2",
  "taskId": "OT-021",
  "taskDefinition": "dogfood/observed-tasks/OT-021.json",
  "taskDefinitionCommit": "0f3a64a44e9a8df216370ebb004a81744730385b",
  "runId": "run-b295934d6c94498a",
  "status": "COMPLETED",
  "baseCommit": "0f3a64a44e9a8df216370ebb004a81744730385b",
  "runStartedAt": "2026-09-14T08:41:04.305Z",
  "runCompletedAt": "2026-09-14T08:43:05.864Z",
  "arms": [
    {
      "armId": "control",
      "runId": "run-859f4822d4c7f305",
      "sessionId": "session-6d8af9160aa86db6",
      "worktreeId": "worktree-6d8af9160aa86db6",
      "baseCommit": "0f3a64a44e9a8df216370ebb004a81744730385b",
      "sourceStateDigest": "9d23daf91efb1f6e8629396e764c986c9f2ecc8072c73bbdb96d195f2a87efef",
      "commands": [
        {
          "id": "build-before",
          "argv": [
            "pnpm",
            "build"
          ],
          "phase": "arm_setup",
          "status": "passed",
          "exitCode": 0,
          "stdoutDigest": "5a81962a4ab5f13543061bfb7efb201886e1fc85d6ccaf77e481f584389443ac",
          "stderrDigest": "6a96bcc19d059808bb261e701012a674d298036e7f1762eb014e622046a91d16"
        },
        {
          "id": "arm-setup",
          "argv": [
            "node",
            "scripts/real-track-a-arm.mjs",
            "--task",
            "dogfood/observed-tasks/OT-021.json",
            "--arm",
            "control"
          ],
          "phase": "arm_setup",
          "status": "passed",
          "exitCode": 0,
          "stdoutDigest": "4239d88e3fe4ee8b331cff643e9192aeb8eb6f9cea5d1bd5fddd2c9166628310",
          "stderrDigest": "e3b0c44298fc1c149afbf4c8996fb92427ae41e4649b934ca495991b7852b855"
        },
        {
          "id": "build-after",
          "argv": [
            "pnpm",
            "build"
          ],
          "phase": "arm_setup",
          "status": "passed",
          "exitCode": 0,
          "stdoutDigest": "335f7c41c17dd6863221e5182718098cb0933981d856b2d8d8c4b3a5febe559d",
          "stderrDigest": "6a96bcc19d059808bb261e701012a674d298036e7f1762eb014e622046a91d16"
        },
        {
          "id": "downstream",
          "argv": [
            "node",
            "--test",
            "packages/code-state/test/code-state.test.ts",
            "apps/my-pi-daemon/test/code-state-lifecycle.test.ts"
          ],
          "phase": "downstream",
          "status": "passed",
          "exitCode": 0,
          "stdoutDigest": "d30e1070f57ce7c4dd91c2bc66b1d209ea2b5dbff47a7148d95ee2e6cab58e7b",
          "stderrDigest": "e3b0c44298fc1c149afbf4c8996fb92427ae41e4649b934ca495991b7852b855"
        }
      ],
      "contamination": {
        "detected": false,
        "reasons": []
      }
    },
    {
      "armId": "treatment",
      "runId": "run-8fbc8ee22192c7b2",
      "sessionId": "session-f701f594d3311f68",
      "worktreeId": "worktree-f701f594d3311f68",
      "baseCommit": "0f3a64a44e9a8df216370ebb004a81744730385b",
      "sourceStateDigest": "9d23daf91efb1f6e8629396e764c986c9f2ecc8072c73bbdb96d195f2a87efef",
      "commands": [
        {
          "id": "build-before",
          "argv": [
            "pnpm",
            "build"
          ],
          "phase": "arm_setup",
          "status": "passed",
          "exitCode": 0,
          "stdoutDigest": "86de96fa34373eea742fbfb88050a564cbad65639d0b7add3f1ec53f222bb111",
          "stderrDigest": "6a96bcc19d059808bb261e701012a674d298036e7f1762eb014e622046a91d16"
        },
        {
          "id": "arm-setup",
          "argv": [
            "node",
            "scripts/real-track-a-arm.mjs",
            "--task",
            "dogfood/observed-tasks/OT-021.json",
            "--arm",
            "treatment"
          ],
          "phase": "arm_setup",
          "status": "passed",
          "exitCode": 0,
          "stdoutDigest": "93562d38a4dd11d1ef8302ec2d0dee0d9c9af0bc896b0bcb395dba2e4be62caa",
          "stderrDigest": "e3b0c44298fc1c149afbf4c8996fb92427ae41e4649b934ca495991b7852b855"
        },
        {
          "id": "build-after",
          "argv": [
            "pnpm",
            "build"
          ],
          "phase": "arm_setup",
          "status": "passed",
          "exitCode": 0,
          "stdoutDigest": "335f7c41c17dd6863221e5182718098cb0933981d856b2d8d8c4b3a5febe559d",
          "stderrDigest": "6a96bcc19d059808bb261e701012a674d298036e7f1762eb014e622046a91d16"
        },
        {
          "id": "downstream",
          "argv": [
            "node",
            "--test",
            "packages/code-state/test/code-state.test.ts",
            "apps/my-pi-daemon/test/code-state-lifecycle.test.ts"
          ],
          "phase": "downstream",
          "status": "passed",
          "exitCode": 0,
          "stdoutDigest": "078ebd9e0953540ac3f604c1753cdedaa16026fe9871d97ed1ce19821e060b12",
          "stderrDigest": "e3b0c44298fc1c149afbf4c8996fb92427ae41e4649b934ca495991b7852b855"
        }
      ],
      "contamination": {
        "detected": false,
        "reasons": []
      }
    }
  ],
  "adjudication": {
    "independent": false,
    "evaluatorRunId": "eval-393cccfcf6ebc93f",
    "recordedAt": "2026-09-14T08:43:05.864Z",
    "outcome": "inconclusive",
    "evidenceRefs": [
      "paired-run-manifest",
      "predeclared-command-results"
    ]
  }
}
