{
  "schemaVersion": "2",
  "recordType": "observed-result-v2",
  "taskId": "OT-012",
  "taskDefinition": "dogfood/observed-tasks/OT-012.json",
  "taskDefinitionCommit": "b97e1f0bd2fa66d3aff10531696210dbafffab24",
  "runId": "run-632340b7a52aa0ed",
  "status": "COMPLETED",
  "baseCommit": "b97e1f0bd2fa66d3aff10531696210dbafffab24",
  "runStartedAt": "2026-09-13T18:48:05.562Z",
  "runCompletedAt": "2026-09-13T18:51:10.701Z",
  "arms": [
    {
      "armId": "control",
      "runId": "run-643b9d68ac8df674",
      "sessionId": "session-fd9b1f8cbf22da58",
      "worktreeId": "worktree-fd9b1f8cbf22da58",
      "baseCommit": "b97e1f0bd2fa66d3aff10531696210dbafffab24",
      "sourceStateDigest": "ad1923629d6ab30d73e91ff48538a5bf5898823c6164e56dd583519f8c5755a7",
      "commands": [
        {
          "id": "build-before",
          "argv": [
            "pnpm",
            "build"
          ],
          "phase": "arm_setup",
          "status": "passed",
          "exitCode": 0,
          "stdoutDigest": "0321a66a3a6f9fd77a88782120a88081d7c5c4292d72161de31400f92ec8eddb",
          "stderrDigest": "6a96bcc19d059808bb261e701012a674d298036e7f1762eb014e622046a91d16"
        },
        {
          "id": "arm-setup",
          "argv": [
            "node",
            "scripts/real-track-a-arm.mjs",
            "--task",
            "dogfood/observed-tasks/OT-012.json",
            "--arm",
            "control"
          ],
          "phase": "arm_setup",
          "status": "passed",
          "exitCode": 0,
          "stdoutDigest": "6d3505bee5616a992d3f4cd431a4eb4b0bd5b45ae4e75625d1493a2eebbb98ed",
          "stderrDigest": "e3b0c44298fc1c149afbf4c8996fb92427ae41e4649b934ca495991b7852b855"
        },
        {
          "id": "build-after",
          "argv": [
            "pnpm",
            "build"
          ],
          "phase": "arm_setup",
          "status": "passed",
          "exitCode": 0,
          "stdoutDigest": "335f7c41c17dd6863221e5182718098cb0933981d856b2d8d8c4b3a5febe559d",
          "stderrDigest": "6a96bcc19d059808bb261e701012a674d298036e7f1762eb014e622046a91d16"
        },
        {
          "id": "independent-evaluator",
          "argv": [
            "node",
            "scripts/evaluate-track-a-arm.mjs",
            "--task",
            "dogfood/observed-tasks/OT-012.json"
          ],
          "phase": "downstream",
          "status": "passed",
          "exitCode": 0,
          "stdoutDigest": "88c79f9c88f7d5bbbe885d213f556acdeba220c49ca4cc74f388e0a720e1dea8",
          "stderrDigest": "e3b0c44298fc1c149afbf4c8996fb92427ae41e4649b934ca495991b7852b855"
        }
      ],
      "contamination": {
        "detected": false,
        "reasons": []
      }
    },
    {
      "armId": "treatment",
      "runId": "run-5d2208aa1be09090",
      "sessionId": "session-e22c7042fda62301",
      "worktreeId": "worktree-e22c7042fda62301",
      "baseCommit": "b97e1f0bd2fa66d3aff10531696210dbafffab24",
      "sourceStateDigest": "ad1923629d6ab30d73e91ff48538a5bf5898823c6164e56dd583519f8c5755a7",
      "commands": [
        {
          "id": "build-before",
          "argv": [
            "pnpm",
            "build"
          ],
          "phase": "arm_setup",
          "status": "passed",
          "exitCode": 0,
          "stdoutDigest": "790b14c876294f8ee6e115c0b5cdacc7ba88ce6dc034076d393ce42ebb12eba6",
          "stderrDigest": "6a96bcc19d059808bb261e701012a674d298036e7f1762eb014e622046a91d16"
        },
        {
          "id": "arm-setup",
          "argv": [
            "node",
            "scripts/real-track-a-arm.mjs",
            "--task",
            "dogfood/observed-tasks/OT-012.json",
            "--arm",
            "treatment"
          ],
          "phase": "arm_setup",
          "status": "passed",
          "exitCode": 0,
          "stdoutDigest": "2a9e664624aa2c37d52ec9cacd553384d404719a2332b1375f63e740710622d9",
          "stderrDigest": "e3b0c44298fc1c149afbf4c8996fb92427ae41e4649b934ca495991b7852b855"
        },
        {
          "id": "build-after",
          "argv": [
            "pnpm",
            "build"
          ],
          "phase": "arm_setup",
          "status": "passed",
          "exitCode": 0,
          "stdoutDigest": "335f7c41c17dd6863221e5182718098cb0933981d856b2d8d8c4b3a5febe559d",
          "stderrDigest": "6a96bcc19d059808bb261e701012a674d298036e7f1762eb014e622046a91d16"
        },
        {
          "id": "independent-evaluator",
          "argv": [
            "node",
            "scripts/evaluate-track-a-arm.mjs",
            "--task",
            "dogfood/observed-tasks/OT-012.json"
          ],
          "phase": "downstream",
          "status": "passed",
          "exitCode": 0,
          "stdoutDigest": "da5dceeead3ec89ae0fc997163e453e0d1fd3326d1cfb070f6af00c70f923b46",
          "stderrDigest": "e3b0c44298fc1c149afbf4c8996fb92427ae41e4649b934ca495991b7852b855"
        }
      ],
      "contamination": {
        "detected": false,
        "reasons": []
      }
    }
  ],
  "adjudication": {
    "independent": false,
    "evaluatorRunId": "eval-937f53d36d2e6bcd",
    "recordedAt": "2026-09-13T18:51:10.701Z",
    "outcome": "inconclusive",
    "evidenceRefs": [
      "paired-run-manifest",
      "predeclared-command-results"
    ]
  }
}
