{
  "schemaVersion": "2",
  "recordType": "observed-result-v2",
  "taskId": "OT-011",
  "taskDefinition": "dogfood/observed-tasks/OT-011.json",
  "taskDefinitionCommit": "b97e1f0bd2fa66d3aff10531696210dbafffab24",
  "runId": "run-decc1df3359b8227",
  "status": "COMPLETED",
  "baseCommit": "b97e1f0bd2fa66d3aff10531696210dbafffab24",
  "runStartedAt": "2026-09-13T18:45:09.656Z",
  "runCompletedAt": "2026-09-13T18:47:33.856Z",
  "arms": [
    {
      "armId": "control",
      "runId": "run-18d496cabfc74595",
      "sessionId": "session-e8181f5f9dde14ec",
      "worktreeId": "worktree-e8181f5f9dde14ec",
      "baseCommit": "b97e1f0bd2fa66d3aff10531696210dbafffab24",
      "sourceStateDigest": "ad1923629d6ab30d73e91ff48538a5bf5898823c6164e56dd583519f8c5755a7",
      "commands": [
        {
          "id": "build-before",
          "argv": [
            "pnpm",
            "build"
          ],
          "phase": "arm_setup",
          "status": "passed",
          "exitCode": 0,
          "stdoutDigest": "ecadea82541e4f7106465fa3b8fcc3c8389a2cecd2b0a895f9cc3a1058b70084",
          "stderrDigest": "6a96bcc19d059808bb261e701012a674d298036e7f1762eb014e622046a91d16"
        },
        {
          "id": "arm-setup",
          "argv": [
            "node",
            "scripts/real-track-a-arm.mjs",
            "--task",
            "dogfood/observed-tasks/OT-011.json",
            "--arm",
            "control"
          ],
          "phase": "arm_setup",
          "status": "passed",
          "exitCode": 0,
          "stdoutDigest": "53a369d498805c29f9ea2543de286293beef4545915d0fc64d60e8a542d74143",
          "stderrDigest": "e3b0c44298fc1c149afbf4c8996fb92427ae41e4649b934ca495991b7852b855"
        },
        {
          "id": "build-after",
          "argv": [
            "pnpm",
            "build"
          ],
          "phase": "arm_setup",
          "status": "passed",
          "exitCode": 0,
          "stdoutDigest": "335f7c41c17dd6863221e5182718098cb0933981d856b2d8d8c4b3a5febe559d",
          "stderrDigest": "6a96bcc19d059808bb261e701012a674d298036e7f1762eb014e622046a91d16"
        },
        {
          "id": "independent-evaluator",
          "argv": [
            "node",
            "scripts/evaluate-track-a-arm.mjs",
            "--task",
            "dogfood/observed-tasks/OT-011.json"
          ],
          "phase": "downstream",
          "status": "passed",
          "exitCode": 0,
          "stdoutDigest": "f5e537f35644938e4fac0c1f1eb14de44c8d534e3a879bfcc1eddf9ebda47bf9",
          "stderrDigest": "e3b0c44298fc1c149afbf4c8996fb92427ae41e4649b934ca495991b7852b855"
        }
      ],
      "contamination": {
        "detected": false,
        "reasons": []
      }
    },
    {
      "armId": "treatment",
      "runId": "run-0a8dedc85369114f",
      "sessionId": "session-914295274dc4012f",
      "worktreeId": "worktree-914295274dc4012f",
      "baseCommit": "b97e1f0bd2fa66d3aff10531696210dbafffab24",
      "sourceStateDigest": "ad1923629d6ab30d73e91ff48538a5bf5898823c6164e56dd583519f8c5755a7",
      "commands": [
        {
          "id": "build-before",
          "argv": [
            "pnpm",
            "build"
          ],
          "phase": "arm_setup",
          "status": "passed",
          "exitCode": 0,
          "stdoutDigest": "5c0290b712e9ee974ec1e7b76e9f12f7cbe73d014c66bec39756261166b88d5a",
          "stderrDigest": "6a96bcc19d059808bb261e701012a674d298036e7f1762eb014e622046a91d16"
        },
        {
          "id": "arm-setup",
          "argv": [
            "node",
            "scripts/real-track-a-arm.mjs",
            "--task",
            "dogfood/observed-tasks/OT-011.json",
            "--arm",
            "treatment"
          ],
          "phase": "arm_setup",
          "status": "passed",
          "exitCode": 0,
          "stdoutDigest": "0d976e68ec5922f0dd65fc1ad64aa88e5ffda84e91ddee1b24ce4729752e5407",
          "stderrDigest": "e3b0c44298fc1c149afbf4c8996fb92427ae41e4649b934ca495991b7852b855"
        },
        {
          "id": "build-after",
          "argv": [
            "pnpm",
            "build"
          ],
          "phase": "arm_setup",
          "status": "passed",
          "exitCode": 0,
          "stdoutDigest": "335f7c41c17dd6863221e5182718098cb0933981d856b2d8d8c4b3a5febe559d",
          "stderrDigest": "6a96bcc19d059808bb261e701012a674d298036e7f1762eb014e622046a91d16"
        },
        {
          "id": "independent-evaluator",
          "argv": [
            "node",
            "scripts/evaluate-track-a-arm.mjs",
            "--task",
            "dogfood/observed-tasks/OT-011.json"
          ],
          "phase": "downstream",
          "status": "passed",
          "exitCode": 0,
          "stdoutDigest": "e4f07ffdf4d602a246381efe233b9002aca61523acff29479411262f323f07ac",
          "stderrDigest": "e3b0c44298fc1c149afbf4c8996fb92427ae41e4649b934ca495991b7852b855"
        }
      ],
      "contamination": {
        "detected": false,
        "reasons": []
      }
    }
  ],
  "adjudication": {
    "independent": true,
    "evaluatorRunId": "eval-9bd05146f6434f26",
    "recordedAt": "2026-09-13T18:47:33.860Z",
    "outcome": "accepted",
    "evidenceRefs": [
      "paired-run-manifest",
      "predeclared-command-results",
      "independent-evaluator-stdout"
    ]
  },
  "measurements": [
    {
      "id": "routing_recall",
      "armId": "control",
      "value": 0.5,
      "unit": "ratio",
      "source": "independent evaluator stdout for OT-011"
    },
    {
      "id": "routing_precision",
      "armId": "control",
      "value": 1,
      "unit": "ratio",
      "source": "independent evaluator stdout for OT-011"
    },
    {
      "id": "selected_items",
      "armId": "control",
      "value": 1,
      "unit": "count",
      "source": "independent evaluator stdout for OT-011"
    },
    {
      "id": "downstream_pass",
      "armId": "control",
      "value": 1,
      "unit": "ratio",
      "source": "independent evaluator stdout for OT-011"
    },
    {
      "id": "repair_iterations",
      "armId": "control",
      "value": 1,
      "unit": "count",
      "source": "independent evaluator stdout for OT-011"
    },
    {
      "id": "routing_recall",
      "armId": "treatment",
      "value": 1,
      "unit": "ratio",
      "source": "independent evaluator stdout for OT-011"
    },
    {
      "id": "routing_precision",
      "armId": "treatment",
      "value": 1,
      "unit": "ratio",
      "source": "independent evaluator stdout for OT-011"
    },
    {
      "id": "selected_items",
      "armId": "treatment",
      "value": 2,
      "unit": "count",
      "source": "independent evaluator stdout for OT-011"
    },
    {
      "id": "downstream_pass",
      "armId": "treatment",
      "value": 1,
      "unit": "ratio",
      "source": "independent evaluator stdout for OT-011"
    },
    {
      "id": "repair_iterations",
      "armId": "treatment",
      "value": 1,
      "unit": "count",
      "source": "independent evaluator stdout for OT-011"
    }
  ]
}
